{
  "schema_version": "1.0.0",
  "pool_id": "musa_operator_candidates_v1",
  "title": "MUSA 新 family 候选算子池",
  "visibility": "maintainer_only",
  "collected_on": "2026-09-27",
  "methodology": {
    "source_policy": "Prefer an official vendor repository. A community repository may corroborate an operator only when its full revision and license are recorded. Search snippets and issue comments are leads, never implementation evidence.",
    "tier_policy": "Apply guide section 1 in order. A direct equivalent library call makes a plain operator unsuitable for A; a B hypothesis is not scoreable until real hidden cases demonstrate at least two gap categories and naive/expert latency ratio >= 1.3.",
    "hardware_policy": "Repository inspection proves only that source and tests exist. No new candidate is marked hardware-validated until it is built, run and measured on a recorded MUSA environment under the evaluator protocol."
  },
  "summary": {
    "source_count": 9,
    "family_count": 6,
    "candidate_count": 19,
    "shortlisted": 12,
    "needs_probe": 5,
    "deferred": 2,
    "hardware_validated": 0
  },
  "sources": [
    {
      "source_id": "kernelbench_local",
      "project": "KernelBench",
      "authority": "local_repository",
      "repository": "https://github.com/Young-Lord/KernelBench",
      "branch": "feat/musa-operator-evaluation-compliance",
      "revision": "8d037710795d00fb23b58a8d43d033ea8f44038e",
      "license": "MIT",
      "license_verified": true,
      "evidence_paths": [
        "KernelBench/level1",
        "KernelBench/level1_musa",
        "KernelBench/level2",
        "deepseek_api_level1_musa_s4000_baseline/eval_results.json",
        "deepseek_api_level1_musa_s4000_baseline/baseline_time_torch.json"
      ],
      "validation_status": "local_source_and_historical_measurement"
    },
    {
      "source_id": "torch_musa",
      "project": "MooreThreads/torch_musa",
      "authority": "vendor_official",
      "repository": "https://github.com/MooreThreads/torch_musa",
      "branch": "main",
      "revision": "2838e77d774a8bcc2593126ad07a3314a399d517",
      "license": "BSD-3-Clause",
      "license_verified": true,
      "evidence_paths": [
        "benchmark/operator_benchmark/tests/matmul_test.py",
        "benchmark/operator_benchmark/tests/rmsnorm_test.py",
        "tests/unittest/operator/test_layer_norm.py",
        "tests/unittest/operator/test_native_group_norm.py",
        "tests/unittest/operator/test_rope_apply.py",
        "tests/unittest/operator/test_segment_reduce.py",
        "tests/unittest/operator/test_topk.py",
        "torch_musa/csrc/aten/mudnn/Convolution.cpp",
        "torch_musa/csrc/aten/mudnn/GroupedMatMul.cpp",
        "torch_musa/csrc/aten/ops/musa/ScanKernels.cpp",
        "torch_musa/csrc/extension/FusedCrossEntropyLoss.mu"
      ],
      "validation_status": "source_tree_verified_not_built_locally"
    },
    {
      "source_id": "mutlass",
      "project": "MooreThreads/MUTLASS",
      "authority": "vendor_official",
      "repository": "https://github.com/MooreThreads/mutlass",
      "branch": "main",
      "revision": "78b349514831ed54a797b717f2fc0534646acff2",
      "license": "BSD-3-Clause",
      "license_verified": true,
      "evidence_paths": [
        "examples/00_basic_gemm/basic_gemm.mu",
        "examples/02_mp31_fp8_gemm_with_collective_builder/mp31_fp8_gemm.mu",
        "examples/03_mp31_fp8_scaling_gemm/fp8_scaling_gemm.mu",
        "include/mutlass/conv/convolution.h",
        "test/unit/gemm/device/mp22_gemm_f32_f32_f32_simt.mu",
        "test/unit/gemm/device/mp31_gemm_sqmma_ss.mu"
      ],
      "validation_status": "source_tree_verified_not_built_locally"
    },
    {
      "source_id": "mate",
      "project": "MooreThreads/MATE",
      "authority": "vendor_official",
      "repository": "https://github.com/MooreThreads/mate",
      "branch": "main",
      "revision": "e5d73e914fcb30aab915a12fae146d9d26357908",
      "license": "Apache-2.0",
      "license_verified": true,
      "evidence_paths": [
        "benchmarks/bench_groupwise_gemm_fp8_mp31.py",
        "benchmarks/bench_hash_topk.py",
        "benchmarks/bench_mega_moe.py",
        "benchmarks/bench_mla_rope_quantize_fp8.py",
        "mate/jit/gemm/masked_moe_gemm_mixed_dtype.py",
        "mate/jit/moe_fused_gate.py",
        "mate/norm/tilelang/fused_add_rmsnorm.py",
        "mate/norm/tilelang/fused_qk_rmsnorm_rope.py"
      ],
      "validation_status": "source_tree_verified_not_built_locally"
    },
    {
      "source_id": "tilelang_musa",
      "project": "tile-ai/TileLang-MUSA",
      "authority": "community_project",
      "repository": "https://github.com/tile-ai/tilelang-musa",
      "branch": "main",
      "revision": "5beb6ee57a35f579ae4a5597fe9531b77ba65596",
      "license": "MIT",
      "license_verified": true,
      "evidence_paths": [
        "examples/convolution/example_convolution.py",
        "examples/dequantize_gemm/example_dequantize_gemm_w4a8.py",
        "examples/fusedmoe/example_fusedmoe_tilelang.py",
        "examples/gdn/example_cumsum.py",
        "examples/gemm/example_gemm.py",
        "examples/grouped_gemm/example_grouped_gemm_fwd.py",
        "examples/norm/rms_norm.py",
        "examples/topk/example_topk.py"
      ],
      "validation_status": "source_tree_verified_not_built_locally"
    },
    {
      "source_id": "vllm_musa",
      "project": "MooreThreads/vLLM-MUSA",
      "authority": "vendor_official",
      "repository": "https://github.com/MooreThreads/vllm-musa",
      "branch": "main",
      "revision": "22937910b056061457f1d24c8d4b9fc5d715c269",
      "license": "Apache-2.0",
      "license_verified": true,
      "evidence_paths": [
        "csrc/musa/fused_add_rmsnorm.mu",
        "csrc/musa/moe/deepseek_v4_topk_softplus_sqrt.mu",
        "csrc/musa/attention/deepseek_v4_inv_rope_fp8_quant.mu",
        "vllm_musa/jit_kernel/csrc/moe/moe_sum_reduce.mu",
        "vllm_musa/jit_kernel/csrc/rope/rotary_embedding.mu",
        "vllm_musa/jit_kernel/csrc/topk/topk_gating.mu",
        "vllm_musa/jit_kernel/tilelang/causal_conv1d.py",
        "vllm_musa/model_executor/layers/fused_moe/dispatch_policy.py"
      ],
      "validation_status": "source_tree_verified_not_built_locally"
    },
    {
      "source_id": "onnxruntime_musa",
      "project": "MooreThreads/ONNX Runtime MUSA",
      "authority": "vendor_official",
      "repository": "https://github.com/MooreThreads/onnxruntime-musa",
      "branch": "master",
      "revision": "1582dd4e9aa309182ab760decc5142578c00fd22",
      "license": "Apache-2.0",
      "license_verified": true,
      "evidence_paths": [
        "musa/docs/supported_ops.md",
        "musa/docs/fusion/gemm_activation.md",
        "musa/docs/fusion/rms_norm.md",
        "musa/docs/fusion/split_reduce.md",
        "musa/docs/fusion/split_sequence_moe.md",
        "musa/ep/src/kernels/math/cumsum_impl.mu",
        "musa/ep/src/kernels/math/topk_impl.mu",
        "musa/ep/src/kernels/nn/moe_impl.mu"
      ],
      "validation_status": "source_tree_verified_not_built_locally"
    },
    {
      "source_id": "flaggems",
      "project": "FlagOS/FlagGems",
      "authority": "community_project",
      "repository": "https://github.com/flagos-ai/FlagGems",
      "branch": "master",
      "revision": "ad9f11380686edac17edc97856bc83f058329290",
      "license": "Apache-2.0",
      "license_verified": true,
      "evidence_paths": [
        "src/flag_gems/fused/fused_add_rms_norm.py",
        "src/flag_gems/fused/grouped_topk.py",
        "src/flag_gems/fused/matmul_bias_activation.py",
        "src/flag_gems/fused/fused_inv_rope_fp8_quant.py",
        "src/flag_gems/ops/conv2d.py",
        "benchmark/test_grouped_matmul.py",
        "benchmark/test_segment_reduce.py"
      ],
      "validation_status": "source_tree_verified_not_built_locally"
    },
    {
      "source_id": "mt_transformer_engine",
      "project": "MooreThreads/MT-TransformerEngine",
      "authority": "vendor_official",
      "repository": "https://github.com/MooreThreads/MT-TransformerEngine",
      "branch": "develop",
      "revision": "58304aafeb3df5fa2ebea17c79aabaae428ac2fc",
      "license": "Apache-2.0",
      "license_verified": true,
      "evidence_paths": [
        "tests/musa/operators/test_gemm.py",
        "tests/musa/operators/test_rms_norm.py",
        "transformer_engine/musa/common/fused_rope/fused_rope.mu",
        "transformer_engine/musa/common/gemm/mudnn_gemm.cpp",
        "transformer_engine/musa/common/fused_softmax/scaled_masked_softmax.mu"
      ],
      "validation_status": "source_tree_verified_not_built_locally"
    }
  ],
  "families": [
    {
      "family_id": "gemm_linear",
      "title": "GEMM、批量/分组矩阵乘与量化线性",
      "selection_reason": "本地 S4000 归档显示多个 GEMM 题的库路径相对朴素 kernel 有 53x 以上差距，同时 MUTLASS、MATE 和 torch_musa 都有独立实现证据。",
      "semantic_contract_focus": ["转置与 batch 广播", "累加 dtype", "量化 scale 粒度", "epilogue 顺序", "ragged group 边界"]
    },
    {
      "family_id": "convolution",
      "title": "卷积、深度可分离卷积与转置卷积",
      "selection_reason": "本地归档中的 Conv2D/ConvTranspose 候选拥有最大的库与朴素实现差距，且存在 shape、group、dilation 和 layout 的自然分派边界。",
      "semantic_contract_focus": ["NCHW/NHWC layout", "padding 约定", "stride/dilation/groups", "output_padding", "bias 与 activation 融合顺序"]
    },
    {
      "family_id": "normalization",
      "title": "RMSNorm、LayerNorm、GroupNorm 与残差融合",
      "selection_reason": "torch_musa 有正式 benchmark 和单元测试，MATE、vLLM-MUSA、ONNX Runtime MUSA 与社区实现又提供了融合版本，适合区分普通库调用和融合调度。",
      "semantic_contract_focus": ["归约轴", "epsilon 位置", "输入与累加 dtype", "affine 参数", "残差写回与 inplace 规则"]
    },
    {
      "family_id": "reduction_scan_selection",
      "title": "归约、Scan 与 TopK 选择",
      "selection_reason": "这些算子有明确的动态轴和非对齐边界，官方源码覆盖 reduce、scan、segment reduce 与 TopK，多项目可交叉核对语义。",
      "semantic_contract_focus": ["轴与 keepdim", "稳定排序和 tie break", "NaN 传播", "exclusive/reverse scan", "空张量与非连续 stride"]
    },
    {